{
  "$schema": "https://json-schema.org/draft/2020-12/schema",
  "$id": "https://gethatch.pet/schemas/lookdev-render-quality3d-v1",
  "title": "Hatch look development render-quality3d v1",
  "description": "Contract validity alone proves no executed shader or renderer capability.",
  "$defs": {
    "render-quality3d": {
      "type": "object",
      "additionalProperties": false,
      "properties": {
        "schema_version": {
          "const": 1
        },
        "id": {
          "type": "string",
          "pattern": "^[A-Za-z0-9][A-Za-z0-9._:-]{0,127}$(?![\\s\\S])"
        },
        "version": {
          "type": "string",
          "pattern": "^(0|[1-9][0-9]*)\\.(0|[1-9][0-9]*)\\.(0|[1-9][0-9]*)$(?![\\s\\S])"
        },
        "name": {
          "type": "string",
          "minLength": 1,
          "maxLength": 4096
        },
        "description": {
          "type": "string",
          "minLength": 1,
          "maxLength": 4096
        },
        "dependencies": {
          "type": "array",
          "items": {
            "$ref": "#/$defs/ResourceRef"
          },
          "minItems": 0,
          "maxItems": 256
        },
        "provenance": {
          "type": "object",
          "additionalProperties": false,
          "properties": {
            "origin": {
              "enum": [
                "import",
                "authored",
                "derived",
                "procedural-fixture"
              ]
            },
            "tool": {
              "type": "string",
              "minLength": 1,
              "maxLength": 4096
            },
            "created_at": {
              "type": "string",
              "pattern": "^\\d{4}-\\d\\d-\\d\\dT\\d\\d:\\d\\d:\\d\\dZ$"
            },
            "source_hashes": {
              "type": "array",
              "items": {
                "type": "string",
                "pattern": "^[0-9a-f]{64}$(?![\\s\\S])"
              },
              "minItems": 0,
              "maxItems": 1024
            },
            "attribution": {
              "type": "string",
              "minLength": 1,
              "maxLength": 4096
            },
            "license": {
              "type": "object",
              "additionalProperties": false,
              "properties": {
                "identifier": {
                  "type": "string",
                  "minLength": 1,
                  "maxLength": 4096
                },
                "source": {
                  "type": "string",
                  "minLength": 1,
                  "maxLength": 4096
                }
              },
              "required": [
                "identifier",
                "source"
              ]
            }
          },
          "required": [
            "origin",
            "tool",
            "created_at",
            "source_hashes",
            "attribution",
            "license"
          ]
        },
        "validation_status": {
          "enum": [
            "unvalidated",
            "structurally-valid",
            "rejected"
          ]
        },
        "tags": {
          "type": "array",
          "items": {
            "type": "string",
            "pattern": "^[A-Za-z0-9][A-Za-z0-9._:-]{0,127}$(?![\\s\\S])"
          },
          "minItems": 0,
          "maxItems": 64
        },
        "capabilities": {
          "type": "array",
          "items": {
            "type": "string",
            "pattern": "^[A-Za-z0-9][A-Za-z0-9._:-]{0,127}$(?![\\s\\S])"
          },
          "minItems": 0,
          "maxItems": 64
        },
        "kind": {
          "const": "render-quality3d"
        },
        "samples": {
          "type": "integer",
          "minimum": 1,
          "maximum": 65536
        },
        "max_bounces": {
          "type": "integer",
          "minimum": 0,
          "maximum": 64
        },
        "resolution": {
          "type": "array",
          "items": {
            "type": "integer",
            "minimum": 1,
            "maximum": 16384
          },
          "minItems": 2,
          "maxItems": 2
        },
        "seed": {
          "type": "integer",
          "minimum": 0,
          "maximum": 4294967295
        },
        "denoise": {
          "type": "boolean"
        },
        "budgets": {
          "type": "object",
          "additionalProperties": false,
          "properties": {
            "memory_bytes": {
              "type": "integer",
              "minimum": 1048576,
              "maximum": 68719476736
            },
            "texture_bytes": {
              "type": "integer",
              "minimum": 1,
              "maximum": 17179869184
            },
            "timeout_seconds": {
              "type": "number",
              "exclusiveMinimum": 0,
              "maximum": 86400
            }
          },
          "required": [
            "memory_bytes",
            "texture_bytes",
            "timeout_seconds"
          ]
        },
        "render_policy": {
          "type": "object",
          "additionalProperties": false,
          "properties": {
            "strict": {
              "type": "boolean"
            },
            "allow_approximations": {
              "type": "boolean"
            },
            "required_features": {
              "type": "array",
              "items": {
                "type": "string",
                "pattern": "^[A-Za-z0-9][A-Za-z0-9._:-]{0,127}$(?![\\s\\S])"
              },
              "minItems": 0,
              "maxItems": 64,
              "uniqueItems": true
            },
            "fallback": {
              "enum": [
                "reject",
                "explicit-approximation",
                "bake"
              ]
            }
          },
          "required": [
            "strict",
            "allow_approximations",
            "required_features",
            "fallback"
          ]
        }
      },
      "required": [
        "schema_version",
        "id",
        "version",
        "dependencies",
        "provenance",
        "validation_status",
        "capabilities",
        "kind",
        "samples",
        "max_bounces",
        "resolution",
        "seed",
        "denoise",
        "budgets",
        "render_policy"
      ]
    },
    "ResourceRef": {
      "type": "object",
      "additionalProperties": false,
      "properties": {
        "id": {
          "type": "string",
          "pattern": "^[A-Za-z0-9][A-Za-z0-9._:-]{0,127}$(?![\\s\\S])"
        },
        "version": {
          "type": "string",
          "pattern": "^(0|[1-9][0-9]*)\\.(0|[1-9][0-9]*)\\.(0|[1-9][0-9]*)$(?![\\s\\S])"
        },
        "path": {
          "type": "string",
          "minLength": 1,
          "maxLength": 4096
        },
        "sha256": {
          "type": "string",
          "pattern": "^[0-9a-f]{64}$(?![\\s\\S])"
        },
        "kind": {
          "enum": [
            "material3d",
            "material-instance3d",
            "material-variant3d",
            "texture3d",
            "material-graph3d",
            "light3d",
            "lighting-rig3d",
            "look3d",
            "render-quality3d"
          ]
        }
      },
      "required": [
        "id",
        "version",
        "path",
        "sha256",
        "kind"
      ]
    }
  },
  "$ref": "#/$defs/render-quality3d"
}
