{"budgets":{"memory_bytes":1073741824,"texture_bytes":1048576,"timeout_seconds":30},"capabilities":[],"denoise":false,"dependencies":[],"id":"draft","kind":"render-quality3d","max_bounces":4,"provenance":{"attribution":"Self-authored engineering fixture","created_at":"2026-10-23T00:00:00Z","license":{"identifier":"CC0-1.0","source":"self-authored"},"origin":"procedural-fixture","source_hashes":[],"tool":"lookdev-contract-tests"},"render_policy":{"allow_approximations":false,"fallback":"reject","required_features":["metallic-roughness"],"strict":true},"resolution":[640,480],"samples":16,"schema_version":1,"seed":7,"validation_status":"unvalidated","version":"1.0.0"}
